### ISSUE TITLE
no multicast traffic with following conf (help please)

### ISSUE THREAD

**Issue by ovidiu31** [braice/MuMuDVB#63]
with full autoconfig i have multicast traffic but channels are having bottlenecks
with partial config when i tcpdump for check traffic i got no multicast packets just
root@debian:~# tcpdump -n host 192.168.50.2
tcpdump: verbose output suppressed, use -v or -vv for full protocol decode
listening on eth0, link-type EN10MB (Ethernet), capture size 65535 bytes
02:53:59.806751 IP 192.168.50.2.22 > 5.13.13.115.50203: Flags [P.], seq 2881423504:2881423700, ack 1650496469, win 148, length 196
02:53:59.853052 IP 5.13.13.115.50203 > 192.168.50.2.22: Flags [.], ack 196, win 256, length 0
02:54:00.807875 IP 192.168.50.2.22 > 5.13.13.115.50203: Flags [P.], seq 196:472, ack 1, win 148, length 276
02:54:01.054256 IP 5.13.13.115.50203 > 192.168.50.2.22: Flags [.], ack 472, win 255, length 0
02:54:01.325682 IP 5.13.13.115.50483 > 192.168.50.2.8888: Flags [P.], seq 2940033849:2940034320, ack 1531971463, win 16425, length                                     471
02:54:01.325704 IP 192.168.50.2.8888 > 5.13.13.115.50483: Flags [.], ack 471, win 330, length 0
02:54:01.425955 IP 192.168.50.2.8888 > 5.13.13.115.50483: Flags [P.], seq 1:1255, ack 471, win 330, length 1254
02:54:01.666682 IP 5.13.13.115.50483 > 192.168.50.2.8888: Flags [.], ack 1255, win 16111, length 0
02:54:01.808963 IP 192.168.50.2.22 > 5.13.13.115.50203: Flags [P.], seq 472:1164, ack 1, win 148, length 692
02:54:02.055668 IP 5.13.13.115.50203 > 192.168.50.2.22: Flags [.], ack 1164, win 252, length 0
02:54:02.810003 IP 192.168.50.2.22 > 5.13.13.115.50203: Flags [P.], seq 1164:1408, ack 1, win 148, length 244
02:54:03.056578 IP 5.13.13.115.50203 > 192.168.50.2.22: Flags [.], ack 1408, win 251, length 0
02:54:03.326481 IP 5.13.13.115.50483 > 192.168.50.2.8888: Flags [P.], seq 471:942, ack 1255, win 16111, length 471
02:54:03.326503 IP 192.168.50.2.8888 > 5.13.13.115.50483: Flags [.], ack 942, win 330, length 0
02:54:03.426732 IP 192.168.50.2.8888 > 5.13.13.115.50483: Flags [P.], seq 1255:2344, ack 942, win 330, length 1089
02:54:03.667909 IP 5.13.13.115.50483 > 192.168.50.2.8888: Flags [.], ack 2344, win 16425, length 0
02:54:03.811075 IP 192.168.50.2.22 > 5.13.13.115.50203: Flags [P.], seq 1408:2084, ack 1, win 148, length 676
02:54:04.057423 IP 5.13.13.115.50203 > 192.168.50.2.22: Flags [.], ack 2084, win 256, length 0
02:54:04.812114 IP 192.168.50.2.22 > 5.13.13.115.50203: Flags [P.], seq 2084:2344, ack 1, win 148, length 260
02:54:05.058459 IP 5.13.13.115.50203 > 192.168.50.2.22: Flags [.], ack 2344, win 255, length 0
02:54:05.327108 IP 5.13.13.115.50483 > 192.168.50.2.8888: Flags [P.], seq 942:1413, ack 2344, win 16425, length 471
02:54:05.327130 IP 192.168.50.2.8888 > 5.13.13.115.50483: Flags [.], ack 1413, win 330, length 0
02:54:05.427367 IP 192.168.50.2.8888 > 5.13.13.115.50483: Flags [P.], seq 2344:3263, ack 1413, win 330, length 919
02:54:05.667152 IP 5.13.13.115.50483 > 192.168.50.2.8888: Flags [.], ack 3263, win 16195, length 0
02:54:05.813173 IP 192.168.50.2.22 > 5.13.13.115.50203: Flags [P.], seq 2344:3020, ack 1, win 148, length 676
02:54:05.997797 IP 192.168.50.2.53388 > 224.2.127.254.9875: UDP, length 246
02:54:05.997807 IP 192.168.50.2.53388 > 224.2.127.254.9875: UDP, length 242
02:54:05.997819 IP 192.168.50.2.53388 > 224.2.127.254.9875: UDP, length 242
02:54:05.997823 IP 192.168.50.2.53388 > 224.2.127.254.9875: UDP, length 239
02:54:05.997827 IP 192.168.50.2.53388 > 224.2.127.254.9875: UDP, length 244
02:54:05.997831 IP 192.168.50.2.53388 > 224.2.127.254.9875: UDP, length 242
02:54:05.997835 IP 192.168.50.2.53388 > 224.2.127.254.9875: UDP, length 243
02:54:05.997838 IP 192.168.50.2.53388 > 224.2.127.254.9875: UDP, length 242
02:54:05.997841 IP 192.168.50.2.53388 > 224.2.127.254.9875: UDP, length 241
02:54:05.997850 IP 192.168.50.2.53388 > 224.2.127.254.9875: UDP, length 242
02:54:05.997853 IP 192.168.50.2.53388 > 224.2.127.254.9875: UDP, length 243
02:54:05.997857 IP 192.168.50.2.53388 > 224.2.127.254.9875: UDP, length 243

routing table is set ok i think

root@debian:~# route -n
Kernel IP routing table
Destination     Gateway         Genmask         Flags Metric Ref    Use Iface
0.0.0.0         192.168.50.1    0.0.0.0         UG    0      0        0 eth0
192.168.50.0    0.0.0.0         255.255.255.0   U     0      0        0 eth0
224.0.0.0       0.0.0.0         255.255.255.0   U     0      0        0 lo
239.255.0.0     0.0.0.0         255.255.255.0   U     0      0        0 lo
239.255.1.0     0.0.0.0         255.255.255.0   U     0      0        0 lo

CONF used
# ------------ TUNING -------------

card=0
# The Transponder frequency

freq=12092
# The polarisation (can be h, v, l, r)

pol=h
# The symbol rate

srate=28000
# the FEC

coderate=7/8
# ---------- AUTOCONFIGURATION -----------
# We want the partial autoconfiguration (ie we discover the pids of the defined channels)

autoconfiguration=partial
# --------- NETWORKING --------------
# Do we want to have the same port for all the channels ?

common_port=1234
# 
# Do we need to change the default multicast TTL (if you have routers, default value : 2) ?
# multicast_iface4=eth0

multicast_ttl=10
# 
# --------- SAP ANNOUNCES --------------
# The sap announces are sent automatically with full autoconfiguration
# Do we want to send the announces ?

sap=1
# 
# What is the default playlist group for the SAP announces (optionnal) ?

sap_default_group=My channels
# Who is the organisation wich send the stream (optionnal) ?

sap_organisation=my_organisation
# The intervall between the SAP announces in second (default 5)

sap_interval=10
# ---------- PAT REWRITING ----------
# If some of the clients are set top boxes we will probably need to rewrite the PAT pid
# rewrite_pat=1
# 
# ---------- SCRAMBLED CHANNELS ----------
# Do we want hadware descrambling ?
# cam_support=1

scam_support=1
ring_buffer_default_size=32768
decsa_default_delay=500000
send_default_delay=1500000
# If you have multiple CAMs you can specify the number of the one wich will be used
# cam_number=2
# ----------------------- THE CHANNELS ---------------------
# Configuration for 12 channels
# Channel number :   0

ip=239.255.0.0
port=1234
name=Mooz Dance HD
service_id=11001
pids=5001 5101 5201
# Channel number :   1

ip=239.255.0.1
port=1234
name=AXN White
cam_pmt_pid=5002
service_id=11002
pids=5002 5102 5202 5302 5402 5502 5602 5702 5802 5902
oscam=1
# Channel number :   2

ip=239.255.0.2
port=1234
name=AXN Black
cam_pmt_pid=5003
service_id=11003
pids=5003 5103 5203 5303 5403 5503 5603 5703 5803 5903
oscam=1
# Channel number :   3

ip=239.255.0.3
port=1234
name=AXN CE
cam_pmt_pid=5004
service_id=11004
pids=5004 5104 5204 5304 5404 5604 5704
oscam=1
# Channel number :   4

ip=239.255.0.4
port=1234
name=AXN Romania
cam_pmt_pid=5005
service_id=11005
pids=5005 5105 5205 5305 5405
oscam=1
# Channel number :   5

ip=239.255.0.5
port=1234
name=AXN Czech
cam_pmt_pid=5006
service_id=11006
pids=5006 5106 5206 5306
oscam=1
# Channel number :   6

ip=239.255.0.6
port=1234
name=Mooz Dance
service_id=11007
pids=5007 5107 5207
# Channel number :   7

ip=239.255.0.7
port=1234
name=Inedit TV
service_id=11008
pids=5008 5108 5208
# Channel number :   8

ip=239.255.0.8
port=1234
name=TVSudEst
service_id=11009
pids=5009 5109 5209
# Channel number :   9

ip=239.255.0.9
port=1234
name=Mynele TV
service_id=11010
pids=5010 5110 5210
# Channel number :  10

ip=239.255.0.10
port=1234
name=TV Sonce
service_id=11011
pids=5011 5111 5211
# Channel number :  11

ip=239.255.0.11
port=1234
name=TV Sutel
service_id=11013
pids=5013 5113 5213
# End of config file
